{
  "clip_id": "demo_hook",
  "format": "horizontal",
  "sample_hz": 2,
  "frames": [
    {
      "t": 0.0,
      "boxes": []
    },
    {
      "t": 1.0,
      "boxes": [
        {
          "id": "title_label",
          "kind": "label",
          "x": 0.35,
          "y": 0.12,
          "w": 0.3,
          "h": 0.08
        }
      ]
    }
  ]
}
